[
  {
    "rank": 1,
    "ingredient_name": "Niacin",
    "medicine_category": "Functional",
    "core_health_problems": "Pellagra, Hyperlipidemia",
    "biomarkers_mentioned": "HDL Cholesterol, LDL Cholesterol, Triglycerides, Hemoglobin A1C, Alanine Aminotransferase (ALT), Aspartate Aminotransferase (AST), Lipoprotein (a)",
    "special_cases": "Hartnup disease, Carcinoid syndrome",
    "cases_when_not_recommended": "Persistent hyperglycemia, Acute gout, Unexplained abdominal pain, New-onset atrial fibrillation, Severe skin reactions, Weight loss, Hepatic transaminase levels more than two or three times the upper limits of normal",
    "similarity_score": 0.14673978090286255,
    "full_document": "Ingredient: Niacin\nMedicine Category: Functional\nCore Health Problems: Pellagra, Hyperlipidemia\nSecondary Health Problems: Cardiovascular disease, Liver problems, Diabetes\nKey Actions: Helps turn food into energy, Supports cell development and function, Lowers LDL cholesterol, Raises HDL cholesterol, Lowers triglycerides, Supports antioxidant function, Maintains genome integrity, Controls gene expression, Facilitates cellular communication\nRelevant Conditions: Atherosclerosis, High blood cholesterol, Low HDL cholesterol, High LDL cholesterol, High triglycerides, Diabetes, Skin flushing, Hepatitis, Liver failure\nBiomarkers Mentioned: HDL Cholesterol, LDL Cholesterol, Triglycerides, Hemoglobin A1C, Alanine Aminotransferase (ALT), Aspartate Aminotransferase (AST), Lipoprotein (a)\nBiomarker Recommendations: {'HDL Cholesterol': 'high'}, {'LDL Cholesterol': 'low'}, {'Triglycerides': 'low'}, {'Hemoglobin A1C': 'unclear'}, {'Alanine Aminotransferase (ALT)': 'unclear'}, {'Aspartate Aminotransferase (AST)': 'unclear'}, {'Lipoprotein (a)': 'low'}\nSpecial Cases: Hartnup disease, Carcinoid syndrome\nCases When Not Recommended: Persistent hyperglycemia, Acute gout, Unexplained abdominal pain, New-onset atrial fibrillation, Severe skin reactions, Weight loss, Hepatic transaminase levels more than two or three times the upper limits of normal\nLifestyle Factors: Undernutrition, Alcohol use disorder, Anorexia, Inflammatory bowel disease, Liver cirrhosis, Low iron intake, Low riboflavin intake, Low vitamin B6 intake\nDescription: Niacin, also known as vitamin B3, plays a critical role in energy production, cell function, and maintaining genome integrity. It is effective in lowering LDL cholesterol, raising HDL cholesterol, and reducing triglycerides, though high doses can lead to side effects such as skin flushing, liver problems, and increased blood sugar levels. Niacin is particularly beneficial for conditions like pellagra, hyperlipidemia, and atherosclerosis but should be used cautiously in individuals with liver issues, diabetes, or severe skin reactions."
  },
  {
    "rank": 2,
    "ingredient_name": "Chromium",
    "medicine_category": "Functional",
    "core_health_problems": "Type 2 diabetes, Metabolic syndrome, Polycystic ovary syndrome (PCOS)",
    "biomarkers_mentioned": "Hemoglobin A1C, HDL Cholesterol, LDL Cholesterol, Triglycerides, Total Cholesterol, Testosterone, Free (calc), Testosterone, Total (Males)",
    "special_cases": "People with kidney disease or liver disease should be cautious about taking high amounts of chromium",
    "cases_when_not_recommended": "Chromium supplements might interact with insulin, metformin, other antidiabetes medications, and levothyroxine",
    "similarity_score": 0.09435230493545532,
    "full_document": "Ingredient: Chromium\nMedicine Category: Functional\nCore Health Problems: Type 2 diabetes, Metabolic syndrome, Polycystic ovary syndrome (PCOS)\nSecondary Health Problems: Dyslipidemia, Weight management\nKey Actions: Potentiates insulin action, Might help carbohydrate, lipid, and protein metabolism, Might have antioxidant effects\nRelevant Conditions: Impaired glucose tolerance, High fasting blood glucose, Elevated LDL cholesterol, Low HDL cholesterol, Elevated triglycerides, Obesity\nBiomarkers Mentioned: Hemoglobin A1C, HDL Cholesterol, LDL Cholesterol, Triglycerides, Total Cholesterol, Testosterone, Free (calc), Testosterone, Total (Males)\nBiomarker Recommendations: Hemoglobin A1C: recommended when high, HDL Cholesterol: recommended when low, LDL Cholesterol: recommended when high, Triglycerides: recommended when high, Total Cholesterol: recommended when high, Testosterone, Free (calc): recommended when high, Testosterone, Total (Males): recommended when high\nSpecial Cases: People with kidney disease or liver disease should be cautious about taking high amounts of chromium\nCases When Not Recommended: Chromium supplements might interact with insulin, metformin, other antidiabetes medications, and levothyroxine\nLifestyle Factors: Dietary intake of high-sugar foods, Use of stainless steel cookware\nDescription: Chromium is a mineral that might help with carbohydrate, lipid, and protein metabolism by potentiating insulin action. It has been studied for its potential benefits in managing type 2 diabetes, metabolic syndrome, PCOS, dyslipidemia, and weight management, though results are mixed. People with kidney or liver disease should be cautious about high chromium intake, and it may interact with medications like insulin, metformin, and levothyroxine."
  },
  {
    "rank": 3,
    "ingredient_name": "Carnitine",
    "medicine_category": "Functional",
    "core_health_problems": "Cardiovascular disease, Peripheral artery disease, Insulin resistance, Type 2 diabetes, Infertility, Osteoarthritis, Alzheimer's disease, Dementia",
    "biomarkers_mentioned": "Apolipoprotein A1 (APOA1), Apolipoprotein B (APOB), LDL Cholesterol, Total Cholesterol, Lipoprotein (a), Triglycerides, % Hemoglobin A1C",
    "special_cases": "Premature infants, Individuals with end-stage renal disease, People on hemodialysis, People with primary carnitine deficiency",
    "cases_when_not_recommended": "People with seizure disorders (risk of increased seizures), People with chronic kidney disease (risk of muscle weakness), High doses (3 grams or more per day) causing nausea, vomiting, stomach cramps, diarrhea, and fishy body odor",
    "similarity_score": 0.05696207284927368,
    "full_document": "Ingredient: Carnitine\nMedicine Category: Functional\nCore Health Problems: Cardiovascular disease, Peripheral artery disease, Insulin resistance, Type 2 diabetes, Infertility, Osteoarthritis, Alzheimer's disease, Dementia\nSecondary Health Problems: Athletic performance issues, Weight loss challenges\nKey Actions: Helps transport long-chain fatty acids into mitochondria for energy production, Supports fatty acid oxidation, Reduces oxidative stress, Improves sperm motility and morphology, May reduce inflammation and pain in osteoarthritis, May improve insulin sensitivity and glucose metabolism\nRelevant Conditions: Alzheimer's disease, Dementia, Cardiovascular disease, Peripheral artery disease, Insulin resistance, Type 2 diabetes, Male infertility, Female infertility (PCOS), Osteoarthritis, Athletic performance, Weight loss\nBiomarkers Mentioned: Apolipoprotein A1 (APOA1), Apolipoprotein B (APOB), LDL Cholesterol, Total Cholesterol, Lipoprotein (a), Triglycerides, % Hemoglobin A1C\nBiomarker Recommendations: {'Apolipoprotein A1 (APOA1)': 'unclear'}, {'Apolipoprotein B (APOB)': 'recommended when high'}, {'LDL Cholesterol': 'recommended when high'}, {'Total Cholesterol': 'recommended when high'}, {'Lipoprotein (a)': 'unclear'}, {'Triglycerides': 'unclear'}, {'% Hemoglobin A1C': 'recommended when high'}\nSpecial Cases: Premature infants, Individuals with end-stage renal disease, People on hemodialysis, People with primary carnitine deficiency\nCases When Not Recommended: People with seizure disorders (risk of increased seizures), People with chronic kidney disease (risk of muscle weakness), High doses (3 grams or more per day) causing nausea, vomiting, stomach cramps, diarrhea, and fishy body odor\nLifestyle Factors: Vegan diet, Vegetarian diet, Low intake of animal products\nDescription: Carnitine is a nutrient that supports energy production by transporting fatty acids into mitochondria and reducing oxidative stress. It may benefit conditions such as cardiovascular disease, peripheral artery disease, insulin resistance, type 2 diabetes, infertility, osteoarthritis, and cognitive decline. However, high doses can cause gastrointestinal issues, muscle weakness in chronic kidney disease, and increased seizure risk in those with seizure disorders."
  },
  {
    "rank": 4,
    "ingredient_name": "Vitamin E",
    "medicine_category": "Functional",
    "core_health_problems": "Heart disease, Cancer, Eye disorders, Cognitive decline",
    "biomarkers_mentioned": "LDL Cholesterol, HDL Cholesterol",
    "special_cases": "Premature babies of very low birth weight, People with fat-malabsorption disorders, People with abetalipoproteinemia, People with ataxia and vitamin E deficiency (AVED)",
    "cases_when_not_recommended": "People undergoing chemotherapy or radiation therapy, People taking anticoagulant or antiplatelet medications, People with low vitamin K intake, Men at risk of prostate cancer",
    "similarity_score": 0.0024738311767578125,
    "full_document": "Ingredient: Vitamin E\nMedicine Category: Functional\nCore Health Problems: Heart disease, Cancer, Eye disorders, Cognitive decline\nSecondary Health Problems: Immune system dysfunction, Oxidative stress-related conditions\nKey Actions: Acts as an antioxidant, Protects cells from free radical damage, Boosts immune system, Inhibits platelet aggregation, Regulates gene expression, Dilates blood vessels, Inhibits blood clotting\nRelevant Conditions: Coronary heart disease, Prostate cancer, Bladder cancer, Age-related macular degeneration (AMD), Cataracts, Alzheimer's disease, Mild cognitive impairment\nBiomarkers Mentioned: LDL Cholesterol, HDL Cholesterol\nBiomarker Recommendations: LDL Cholesterol: unclear, HDL Cholesterol: unclear\nSpecial Cases: Premature babies of very low birth weight, People with fat-malabsorption disorders, People with abetalipoproteinemia, People with ataxia and vitamin E deficiency (AVED)\nCases When Not Recommended: People undergoing chemotherapy or radiation therapy, People taking anticoagulant or antiplatelet medications, People with low vitamin K intake, Men at risk of prostate cancer\nLifestyle Factors: Exposure to cigarette smoke, Air pollution, Ultraviolet light from the sun\nDescription: Vitamin E is a fat-soluble antioxidant that protects cells from free radical damage and supports immune function. It has been studied for its potential benefits in heart disease, cancer, eye disorders, and cognitive decline, though results are inconsistent. High doses of vitamin E supplements may pose risks, including increased bleeding and prostate cancer in men."
  },
  {
    "rank": 5,
    "ingredient_name": "Choline",
    "medicine_category": "Functional",
    "core_health_problems": "Cardiovascular disease, Neurological disorders, Nonalcoholic fatty liver disease (NAFLD)",
    "biomarkers_mentioned": "Alanine Aminotransferase (ALT)",
    "special_cases": "Pregnant women, People with certain genetic conditions, Patients requiring total parenteral nutrition (TPN)",
    "cases_when_not_recommended": "High choline intake may increase cardiovascular disease risk",
    "similarity_score": -0.06337833404541016,
    "full_document": "Ingredient: Choline\nMedicine Category: Functional\nCore Health Problems: Cardiovascular disease, Neurological disorders, Nonalcoholic fatty liver disease (NAFLD)\nSecondary Health Problems: Muscle damage, Liver damage, Fat deposits in the liver\nKey Actions: Regulates memory, mood, and muscle control, Forms cell membranes, Supports liver function, Modulates gene expression, Affects lipid transport and metabolism\nRelevant Conditions: Cardiovascular disease, Neurological disorders, Nonalcoholic fatty liver disease (NAFLD), Neural tube defects\nBiomarkers Mentioned: Alanine Aminotransferase (ALT)\nBiomarker Recommendations: ALT: recommended when high\nSpecial Cases: Pregnant women, People with certain genetic conditions, Patients requiring total parenteral nutrition (TPN)\nCases When Not Recommended: High choline intake may increase cardiovascular disease risk\nLifestyle Factors: Pregnancy, Low vitamin B12 status, Low folate intake, Obesity, Overweight\nDescription: Choline is an essential nutrient required for brain and nervous system functions, including memory and mood regulation, as well as for forming cell membranes and supporting liver function. It may help prevent nonalcoholic fatty liver disease (NAFLD) and support cardiovascular health, though excessive intake could increase cardiovascular disease risk. Pregnant women, individuals with genetic conditions, and patients on total parenteral nutrition are at higher risk of choline inadequacy."
  },
  {
    "rank": 6,
    "ingredient_name": "Zinc",
    "medicine_category": "Functional",
    "core_health_problems": "Diarrhea in children, Age-related macular degeneration (AMD), Acute childhood diarrhea, Pneumonia in children",
    "biomarkers_mentioned": "HDL Cholesterol, LDL Cholesterol, Triglycerides, Total Cholesterol, Hemoglobin A1C, C-Reactive Protein",
    "special_cases": "Pregnancy, Lactation, Older infants who are exclusively breastfed, Children with sickle cell disease, People with gastrointestinal disorders or bariatric surgery",
    "cases_when_not_recommended": "Excessive use of denture adhesive creams containing zinc, Taking zinc supplements with quinolone or tetracycline antibiotics without proper timing, Taking zinc supplements with penicillamine without proper timing",
    "similarity_score": -0.07957610643249713,
    "full_document": "Ingredient: Zinc\nMedicine Category: Functional\nCore Health Problems: Diarrhea in children, Age-related macular degeneration (AMD), Acute childhood diarrhea, Pneumonia in children\nSecondary Health Problems: Common cold, Type 2 diabetes, HIV-related complications, Gestational diabetes, Diabetic foot ulcers\nKey Actions: Supports immune function, Aids in DNA and protein synthesis, Promotes wound healing, Enhances growth and development, Maintains mucosal integrity of the gastrointestinal system\nRelevant Conditions: Common cold, Pneumonia, HIV, Diarrhea, Age-related macular degeneration, Type 2 diabetes, Gestational diabetes, Diabetic foot ulcers\nBiomarkers Mentioned: HDL Cholesterol, LDL Cholesterol, Triglycerides, Total Cholesterol, Hemoglobin A1C, C-Reactive Protein\nBiomarker Recommendations: {'HDL Cholesterol': 'low'}, {'LDL Cholesterol': 'high'}, {'Triglycerides': 'high'}, {'Total Cholesterol': 'high'}, {'Hemoglobin A1C': 'high'}, {'C-Reactive Protein': 'high'}\nSpecial Cases: Pregnancy, Lactation, Older infants who are exclusively breastfed, Children with sickle cell disease, People with gastrointestinal disorders or bariatric surgery\nCases When Not Recommended: Excessive use of denture adhesive creams containing zinc, Taking zinc supplements with quinolone or tetracycline antibiotics without proper timing, Taking zinc supplements with penicillamine without proper timing\nLifestyle Factors: Vegetarian or vegan diets, Alcohol use disorder, Low intake of absorbable zinc in low-income countries\nDescription: Zinc is an essential mineral that supports immune function, DNA and protein synthesis, wound healing, and growth. It is beneficial for conditions such as diarrhea in children, age-related macular degeneration, and pneumonia. Zinc supplementation may also help manage secondary issues like the common cold, type 2 diabetes, and HIV-related complications, though excessive intake or improper use with certain medications can lead to adverse effects."
  }
]